{"authorization":{"branch":"codex/m4-cross-engineering-forward-evaluation-m4.1-one-shot-authorization","ci_conclusion":"success","ci_run_id":31251141941,"claim_consumes_entire_authorization":true,"head":"ae1ad43cca52ae450e146e952e3b108792b2b665","token":"sha256:b5fe4ee85f59935a32d6b1a93cf7a5ec64fdbb51348fab624d83c4292f646109","token_status_after_claim":"CONSUMED","token_status_before_claim":"UNCONSUMED"},"batch_order":["M4.1-BATCH-NUC","M4.1-BATCH-MEC","M4.1-BATCH-ELE","M4.1-BATCH-AUT","M4.1-BATCH-COM","M4.1-BATCH-MPH"],"batches":[{"batch_id":"M4.1-BATCH-NUC","planned_task_count":10,"sequence":1,"task_ids":["M4.1-NUC-A-F","M4.1-NUC-B-A1","M4.1-NUC-A-A1","M4.1-NUC-B-A3","M4.1-NUC-A-A2","M4.1-NUC-B-F","M4.1-NUC-A-N","M4.1-NUC-B-A2","M4.1-NUC-A-A3","M4.1-NUC-B-N"]},{"batch_id":"M4.1-BATCH-MEC","planned_task_count":10,"sequence":2,"task_ids":["M4.1-MEC-A-N","M4.1-MEC-A-A1","M4.1-MEC-B-F","M4.1-MEC-A-A3","M4.1-MEC-B-A3","M4.1-MEC-B-A1","M4.1-MEC-B-A2","M4.1-MEC-A-A2","M4.1-MEC-A-F","M4.1-MEC-B-N"]},{"batch_id":"M4.1-BATCH-ELE","planned_task_count":10,"sequence":3,"task_ids":["M4.1-ELE-B-A2","M4.1-ELE-B-A1","M4.1-ELE-A-A1","M4.1-ELE-A-N","M4.1-ELE-A-F","M4.1-ELE-B-A3","M4.1-ELE-B-N","M4.1-ELE-B-F","M4.1-ELE-A-A3","M4.1-ELE-A-A2"]},{"batch_id":"M4.1-BATCH-AUT","planned_task_count":10,"sequence":4,"task_ids":["M4.1-AUT-B-A2","M4.1-AUT-B-A3","M4.1-AUT-A-A3","M4.1-AUT-B-A1","M4.1-AUT-A-A1","M4.1-AUT-B-N","M4.1-AUT-A-A2","M4.1-AUT-B-F","M4.1-AUT-A-N","M4.1-AUT-A-F"]},{"batch_id":"M4.1-BATCH-COM","planned_task_count":10,"sequence":5,"task_ids":["M4.1-COM-B-F","M4.1-COM-B-A1","M4.1-COM-B-A2","M4.1-COM-A-N","M4.1-COM-B-N","M4.1-COM-A-A3","M4.1-COM-B-A3","M4.1-COM-A-A2","M4.1-COM-A-F","M4.1-COM-A-A1"]},{"batch_id":"M4.1-BATCH-MPH","planned_task_count":10,"sequence":6,"task_ids":["M4.1-MPH-B-F","M4.1-MPH-A-N","M4.1-MPH-A-A2","M4.1-MPH-A-A1","M4.1-MPH-A-A3","M4.1-MPH-B-A2","M4.1-MPH-A-F","M4.1-MPH-B-N","M4.1-MPH-B-A1","M4.1-MPH-B-A3"]}],"claim_count":1,"claim_id":"32e0df57-a8d2-5c19-9ffc-da69997686e8","claimed_at_utc":"2026-08-08T14:28:37Z","configured_defaults":{"configured_default_check":"MATCHED","create_thread_model_field":"OMITTED","create_thread_thinking_field":"OMITTED","exact_model_id":"gpt-5.6-sol","reasoning_effort":"max"},"creation_semantics":{"mechanism":"python_os_open_O_CREAT_O_EXCL","overwrite_allowed":false,"target_path":"evals/m4/execution/m4.1/launch-claim.json","target_preexisted":false},"does_not_authorize":["a second launch claim or a second attempt for any M4.1 task ID","a retry, repair, continuation, or follow-up message","a task outside the frozen 60-task M4.1 matrix","cross-task or cross-arm result visibility","research-content analysis or arm comparison during execution","judge execution, blind-map access, or unblinding","result aggregation or acceptance-threshold claims","changes to cases, prompts, variants, rubric, thresholds, or randomization","M4 closure, M5, an experiment, simulation, training run, deployment, or control action"],"execution_protocol":{"branch":"codex/m4-cross-engineering-forward-evaluation-m4.1-one-shot-execution","ci_conclusion":"success","ci_run_id":31255966197,"head":"bb1b8a5e4bab46d625c637d564d8132dc69a21ab"},"frozen_bindings":{"authorization":{"path":"evals/m4/authorization/m4.1/execution-authorization.json","raw_sha256":"8e706255d032cb861135e2d13ef2ab640af97f19de980e501455cba3785fa259"},"execution_control":{"path":"evals/m4/authorization/m4.1/execution-control.json","raw_sha256":"4b90721b53192c0244e309344e56da94be61f78ff5aaae96d8035a5767a38060"},"execution_helper":{"path":"evals/m4/execution/prepare_m4_1_request_bundles.ps1","raw_sha256":"ab0f82438d28a8b704075772889028e4f0eeab10eb1ec294df7fc3d0eb06d2e0"},"preparation_manifest":{"path":"evals/m4/revisions/m4.1/preparation-manifest.json","raw_sha256":"d66ad9d513d8e64307f9a1553242d9b7d840ea5432d084b06d86707c1b4c2b61"}},"limits":{"aggregation_calls":0,"attempts_per_task_id":1,"finalizations":60,"followups":0,"initial_requests":60,"judge_calls":0,"repairs":0,"retries":0,"side_effects":0,"tasks":60,"threads":60},"milestone":"M4","project":{"environment":"worktree","is_git_repository":true,"project_id":"ff35b25f-4644-41c8-9073-74c697559439","starting_branch":"codex/m4-cross-engineering-forward-evaluation-m4.1-one-shot-authorization","starting_head":"ae1ad43cca52ae450e146e952e3b108792b2b665"},"request_binding_aggregate":{"algorithm":"sha256-canonical-json-task-request-bindings-v1","ordered_pair_count":60,"sha256":"bccd78e80c338818929b825ca6624639529ba73d2817f22e63676b8aaeced500"},"revision":"M4.1","schema_version":"m4.1-launch-claim-v1","status":"CLAIMED","task_claims":[{"batch_id":"M4.1-BATCH-NUC","context_id":"9461f943-64f9-54d5-a349-88b7eac04955","finalization_id":"3476e291-29fe-5d58-a7c3-8b5309058b3b","request_binding_sha256":"db72f3e8e525a9ffc588bcb001db3d4c58d51be17f3f78ff99a522c2d11250f9","result_root":"evals/m4/results/m4.1/M4.1-NUC-A-F","task_id":"M4.1-NUC-A-F"},{"batch_id":"M4.1-BATCH-NUC","context_id":"eeb6fabb-9ac6-551d-b036-3cab21e72fa1","finalization_id":"d16611a2-c904-5db7-957e-ccf34cf8e13b","request_binding_sha256":"eedd1bc188afd1dbd6aa41c8158208183e977e4b3ebcb56a163535cd997dff4c","result_root":"evals/m4/results/m4.1/M4.1-NUC-B-A1","task_id":"M4.1-NUC-B-A1"},{"batch_id":"M4.1-BATCH-NUC","context_id":"2038d68a-6a27-5a1d-83af-19ddae14f796","finalization_id":"2ddcd365-9e58-59d8-8233-f85d0089b1d0","request_binding_sha256":"5006bad7240a3bfa7e1a353c5db22dcd0238113884ed3e0485fca7535529db21","result_root":"evals/m4/results/m4.1/M4.1-NUC-A-A1","task_id":"M4.1-NUC-A-A1"},{"batch_id":"M4.1-BATCH-NUC","context_id":"7543dcdb-1783-5c35-88e7-4d1b2b1df48e","finalization_id":"afd05ae0-35cd-57e6-806c-bd549afedc54","request_binding_sha256":"891f2c30c28251e262a6fcd52b375eb3141d3cf237f7cb30134faa5491829b2d","result_root":"evals/m4/results/m4.1/M4.1-NUC-B-A3","task_id":"M4.1-NUC-B-A3"},{"batch_id":"M4.1-BATCH-NUC","context_id":"89d5714b-7928-5945-8d80-4dfeabfd3c41","finalization_id":"5f0df51a-0022-5a40-8779-2cf9b1b29955","request_binding_sha256":"6f8fe623335f61d54545dcfba5e007adedbeeeba48d6a4d0c98d71986722f8be","result_root":"evals/m4/results/m4.1/M4.1-NUC-A-A2","task_id":"M4.1-NUC-A-A2"},{"batch_id":"M4.1-BATCH-NUC","context_id":"3e7ff97f-43ef-5d0b-b9a2-ff764ae03c1b","finalization_id":"e5e87922-6c74-5182-bc77-3eae521ba1de","request_binding_sha256":"4d89b3fdeb6b6db70a6c9a6c8d7cd24d6b00628a06c7ad513cca02a213d73e70","result_root":"evals/m4/results/m4.1/M4.1-NUC-B-F","task_id":"M4.1-NUC-B-F"},{"batch_id":"M4.1-BATCH-NUC","context_id":"d3eddd4c-c4f3-5ec4-b9a0-6cb95329177d","finalization_id":"503cfe9b-c504-5b2b-aded-2f289186b168","request_binding_sha256":"e2d61f4aea3c66d76ddcbd81d000b633fb0faf444d7e9e7a2eaf04515c6e1230","result_root":"evals/m4/results/m4.1/M4.1-NUC-A-N","task_id":"M4.1-NUC-A-N"},{"batch_id":"M4.1-BATCH-NUC","context_id":"42502e4d-4950-561e-9af9-9f63336ee060","finalization_id":"8b0000d8-4181-5c62-9ef5-ba95b6bda481","request_binding_sha256":"3f10ac69fc19cb143321dcd595e990c1556cfa91644a4c87eea3ec3b513672e3","result_root":"evals/m4/results/m4.1/M4.1-NUC-B-A2","task_id":"M4.1-NUC-B-A2"},{"batch_id":"M4.1-BATCH-NUC","context_id":"900f77c6-85da-5657-b780-8c73dc37fcae","finalization_id":"7b280059-26b6-5832-8d58-51a4daf3ff9c","request_binding_sha256":"86a9cb8314415501096b6b355b24fd51e35664969ecfb1947cb9de4c09c921c8","result_root":"evals/m4/results/m4.1/M4.1-NUC-A-A3","task_id":"M4.1-NUC-A-A3"},{"batch_id":"M4.1-BATCH-NUC","context_id":"d6c08116-9aef-5aa5-bab2-e13e2f09d1e8","finalization_id":"817cddcf-5afc-5dc1-9a22-bc1dbb590c15","request_binding_sha256":"cb16df35bf5db595c268c3e16364484bdeb4a587861c0f4740873b9719dc9cff","result_root":"evals/m4/results/m4.1/M4.1-NUC-B-N","task_id":"M4.1-NUC-B-N"},{"batch_id":"M4.1-BATCH-MEC","context_id":"1de8e670-30c1-51ff-aeb7-4598b86bc016","finalization_id":"482d6b80-c4a4-56b9-aa96-d320ed7eebd4","request_binding_sha256":"21ace54265282f93f8294e8d2b8fd9aa21ecb3a8df3f074d9a24a99d172ad55f","result_root":"evals/m4/results/m4.1/M4.1-MEC-A-N","task_id":"M4.1-MEC-A-N"},{"batch_id":"M4.1-BATCH-MEC","context_id":"18261574-d52e-5da2-8bf9-63685904c759","finalization_id":"df3a1154-14e7-5a07-9f68-66b953ab9006","request_binding_sha256":"0e412c6f33d296782840ea1cffb93b8a22e178565a505cd56c15e85753b969b3","result_root":"evals/m4/results/m4.1/M4.1-MEC-A-A1","task_id":"M4.1-MEC-A-A1"},{"batch_id":"M4.1-BATCH-MEC","context_id":"73cc4b5b-3e3f-58be-9416-2e887d8838b2","finalization_id":"1b3d656d-708d-5c6c-9dc4-1a5d0ffd2f82","request_binding_sha256":"744ecb857fb2eb6059d719b66a192d8b6fd15f023ad62304fccb3f9e69e52d04","result_root":"evals/m4/results/m4.1/M4.1-MEC-B-F","task_id":"M4.1-MEC-B-F"},{"batch_id":"M4.1-BATCH-MEC","context_id":"654a4dd4-10bd-584e-b043-4bd158ad9fc1","finalization_id":"f92295bf-7e0f-5e53-8ef3-40ac40713bc7","request_binding_sha256":"eb246313dda74627b7d6d538feaec6feb47eecc9b2741370fda1c667cf6d5333","result_root":"evals/m4/results/m4.1/M4.1-MEC-A-A3","task_id":"M4.1-MEC-A-A3"},{"batch_id":"M4.1-BATCH-MEC","context_id":"76f4e84a-47ff-5f15-b953-f3bfffa0d2b1","finalization_id":"6818cd0a-6cb6-5f16-a07f-c8af61c36554","request_binding_sha256":"44ff1bf4d54859d64c6d81a71cbcfb316d50c45ad46c100ed5b5a2634ed56959","result_root":"evals/m4/results/m4.1/M4.1-MEC-B-A3","task_id":"M4.1-MEC-B-A3"},{"batch_id":"M4.1-BATCH-MEC","context_id":"9e244f92-c9b7-587f-9359-93acf5043c7a","finalization_id":"e1df3845-1021-52fb-9b4b-a94b86110399","request_binding_sha256":"d87e407abdf6725f1769289ed4f913b6cc26a16682c857472a1866cc50fc3927","result_root":"evals/m4/results/m4.1/M4.1-MEC-B-A1","task_id":"M4.1-MEC-B-A1"},{"batch_id":"M4.1-BATCH-MEC","context_id":"2beb76b0-d8b0-5680-a671-9723dec4a309","finalization_id":"94753bfc-961d-5370-b899-c6b284e84b64","request_binding_sha256":"0e23428348e31bcee3995fcc048da3e2d7c5a4cc6ec6ef519d40bd63f3ab7785","result_root":"evals/m4/results/m4.1/M4.1-MEC-B-A2","task_id":"M4.1-MEC-B-A2"},{"batch_id":"M4.1-BATCH-MEC","context_id":"e1223fb3-4ca9-5316-afec-9702a92703e8","finalization_id":"ade530d0-4002-5e09-a3dc-